<?xml version="1.0" encoding="utf-8" ?>
<database
        xmlns="http://www.github.com/hamiguazzz"
        xmlns:xsi="http://www.w3.org/2001/XMLSchema-instance"
        xsi:schemaLocation="http://www.github.com/hamiguazzz file://database.xsd"
        name="wordlist">
    <table name="trace" codename="trace">
        <column name="word" codename="word" type="varchar" size="64"/>
        <column name="progress" codename="progress" type="unsigned" size="16"/>
        <column name="easy" codename="easy" type="unsigned" size="16"/>
        <column name="forget" codename="forget" type="unsigned" size="16"/>
        <column name="last_read_time" codename="lastReadTime" type="datetime" size="0"/>
        <column name="first_read_time" codename="firstReadTime" type="datetime" size="0"/>
        <column name="tags" codename="tags" type="varchar" size="128"/>
    </table>
</database>